{
  "scale_px_per_m": 23.9714,
  "products": [
    {
      "item_no": "10367461",
      "name": "ALEFJ\u00c3\u201eLL office chair",
      "color": "Glose black"
    },
    {
      "item_no": "00492205",
      "name": "FLINTAN office chair",
      "color": "beige"
    },
    {
      "item_no": "90489029",
      "name": "FLINTAN office chair",
      "color": "black"
    },
    {
      "item_no": "30532912",
      "name": "GR\u00c3\u2013NFJ\u00c3\u201eLL office chair with armrests",
      "color": "Letafors yellow-brown/black"
    },
    {
      "item_no": "30339735",
      "name": "FJ\u00c3\u201eLLBO laptop table",
      "color": "black"
    },
    {
      "item_no": "20541610",
      "name": "GLADH\u00c3\u2013JDEN desk sit/stand",
      "color": "light gray/anthracite"
    },
    {
      "item_no": "90539166",
      "name": "HUVUDSPELARE gaming desk",
      "color": "black"
    },
    {
      "item_no": "50250713",
      "name": "MICKE corner workstation",
      "color": "white"
    },
    {
      "item_no": "10538203",
      "name": "TONSTAD desk",
      "color": "brown stained oak veneer"
    },
    {
      "item_no": "20538207",
      "name": "TONSTAD desk",
      "color": "brown stained oak veneer"
    },
    {
      "item_no": "40586400",
      "name": "UTVISNING gaming desk with shelf",
      "color": "black"
    },
    {
      "item_no": "40396419",
      "name": "FJ\u00c3\u201eLLBERGET conference chair with casters",
      "color": "black stained ash veneer/Gunnared dark gray"
    },
    {
      "item_no": "20586255",
      "name": "B\u00c3\u201eSTBOLL gaming chair",
      "color": "black/Mjuk black"
    },
    {
      "item_no": "00507589",
      "name": "GRUPPSPEL gaming chair",
      "color": "Gunnared beige"
    },
    {
      "item_no": "90590490",
      "name": "STOCKHOLM 2025 vase",
      "color": "brown"
    },
    {
      "item_no": "70604488",
      "name": "VINTERFINT cup and saucer",
      "color": "dark green"
    },
    {
      "item_no": "50611055",
      "name": "HEAT trivet",
      "color": "cork patterned/light blue"
    },
    {
      "item_no": "80596176",
      "name": "BRUGDHAJ jar with lid",
      "color": "blue"
    },
    {
      "item_no": "90578167",
      "name": "HALVTOM spice mill",
      "color": "glass/brown"
    },
    {
      "item_no": "30531936",
      "name": "NATTGIBBA laundry basket",
      "color": "willow/handmade"
    },
    {
      "item_no": "70503583",
      "name": "SALUDING laundry basket",
      "color": "handmade bamboo"
    },
    {
      "item_no": "60460107",
      "name": "DR\u00c3\u2013NJ\u00c3\u2013NS wastepaper basket",
      "color": "white"
    },
    {
      "item_no": "80595389",
      "name": "G\u00c3\u2026NGSKYFFEL pedal bin",
      "color": "gray-green"
    },
    {
      "item_no": "20511217",
      "name": "STABBEN step trash can",
      "color": "stainless steel"
    },
    {
      "item_no": "20494331",
      "name": "ANKARSPEL floor/reading lamp with LED bulb",
      "color": "pewter effect"
    },
    {
      "item_no": "40494349",
      "name": "ANKARSPEL work lamp",
      "color": "pewter effect"
    },
    {
      "item_no": "80520935",
      "name": "BL\u00c3\u2026SVERK table lamp",
      "color": "beige"
    },
    {
      "item_no": "80568220",
      "name": "H\u00c3\u2013GVIND table lamp",
      "color": "nickel plated/gray glass"
    },
    {
      "item_no": "70216544",
      "name": "HEKTAR floor lamp",
      "color": "dark gray"
    },
    {
      "item_no": "10601204",
      "name": "KUDDLAVA table lamp",
      "color": "pleated white"
    },
    {
      "item_no": "10464283",
      "name": "SOLKLINT table lamp",
      "color": "brass/gray clear glass"
    },
    {
      "item_no": "40437702",
      "name": "UPPVIND table lamp",
      "color": "nickel plated/white"
    },
    {
      "item_no": "40610607",
      "name": "FEJKA artificial potted plant",
      "color": "indoor/outdoor/bamboo"
    },
    {
      "item_no": "30578071",
      "name": "FEJKA artificial potted plant",
      "color": "indoor/outdoor Bird of paradise"
    },
    {
      "item_no": "60587154",
      "name": "FEJKA artificial potted plant",
      "color": "indoor/outdoor cactus"
    },
    {
      "item_no": "40395288",
      "name": "FEJKA artificial potted plant",
      "color": "indoor/outdoor monstera"
    },
    {
      "item_no": "80285909",
      "name": "FEJKA artificial potted plant",
      "color": "Orchid white"
    },
    {
      "item_no": "40612319",
      "name": "DOFTRIPS watering can",
      "color": "stainless steel"
    },
    {
      "item_no": "80586530",
      "name": "BR\u00c3\u201eNNBOLL gaming rug",
      "color": "black"
    },
    {
      "item_no": "10556225",
      "name": "PLANKORSNING rug, low pile",
      "color": "gray/beige"
    },
    {
      "item_no": "90560313",
      "name": "RASTPLATS rug, flatwoven",
      "color": "handmade beige/black"
    },
    {
      "item_no": "80589576",
      "name": "SPRETGR\u00c3\u201eS rug, high pile",
      "color": "Mixdala"
    },
    {
      "item_no": "10593812",
      "name": "STOCKHOLM 2025 rug, flatwoven",
      "color": "black/white/light green handwoven"
    },
    {
      "item_no": "40593815",
      "name": "STOCKHOLM 2025 rug, flatwoven",
      "color": "white/brown/light blue handwoven"
    },
    {
      "item_no": "70593814",
      "name": "STOCKHOLM 2025 rug, flatwoven",
      "color": "white/brown/light blue handwoven"
    },
    {
      "item_no": "70607057",
      "name": "T\u00c3\u2026GFORDON door mat",
      "color": "black/dot pattern"
    },
    {
      "item_no": "20560806",
      "name": "TVERSTED rug, low pile",
      "color": "beige"
    },
    {
      "item_no": "80569248",
      "name": "FLYGFISK placemat",
      "color": "light beige"
    },
    {
      "item_no": "40581921",
      "name": "DYVLINGE swivel chair",
      "color": "Kelinge orange"
    },
    {
      "item_no": "30533493",
      "name": "EKEN\u00c3\u201eSET armchair",
      "color": "Kilanda light beige"
    },
    {
      "item_no": "80425641",
      "name": "FR\u00c3\u2013SET chair",
      "color": "white stained oak veneer"
    },
    {
      "item_no": "60438550",
      "name": "MUREN recliner",
      "color": "Remmarn light gray"
    },
    {
      "item_no": "40594754",
      "name": "STOCKHOLM 2025 armchair",
      "color": "Djurmo gray/white"
    },
    {
      "item_no": "40456960",
      "name": "STRANDMON wing chair",
      "color": "Vibberbo black/beige"
    },
    {
      "item_no": "90531660",
      "name": "HAVBERG ottoman",
      "color": "Grann/Bomstad golden brown"
    },
    {
      "item_no": "40591755",
      "name": "STOCKHOLM 2025 1-seat section",
      "color": "Alhamn dark brown"
    },
    {
      "item_no": "20586137",
      "name": "STOCKHOLM 2025 1-seat section",
      "color": "Djurmo gray/white"
    },
    {
      "item_no": "40586117",
      "name": "STOCKHOLM 2025 loveseat",
      "color": "Alhamn beige"
    },
    {
      "item_no": "30591751",
      "name": "STOCKHOLM 2025 loveseat",
      "color": "Alhamn dark brown"
    },
    {
      "item_no": "40586122",
      "name": "STOCKHOLM 2025 loveseat",
      "color": "Djurmo gray/white"
    },
    {
      "item_no": "60586692",
      "name": "STOCKHOLM 2025 glass-door cabinet",
      "color": "oak veneer"
    },
    {
      "item_no": "10413528",
      "name": "HEMNES TV unit",
      "color": "white stain/light brown"
    },
    {
      "item_no": "50542750",
      "name": "J\u00c3\u201eTTESTA TV unit",
      "color": "white/light bamboo"
    },
    {
      "item_no": "10542747",
      "name": "SKRUVBY TV unit",
      "color": "black-blue"
    },
    {
      "item_no": "90586638",
      "name": "STOCKHOLM 2025 TV unit with sliding doors",
      "color": "oak veneer"
    },
    {
      "item_no": "70389356",
      "name": "BORGEBY coffee table",
      "color": "birch veneer"
    },
    {
      "item_no": "70597162",
      "name": "H\u00c3\u2026KANSK\u00c3\u201eR coffee table",
      "color": "outdoor/light brown stained"
    },
    {
      "item_no": "80270125",
      "name": "L\u00c3\u2013VBACKEN side table",
      "color": "medium brown"
    },
    {
      "item_no": "00104291",
      "name": "LACK coffee table",
      "color": "black-brown"
    },
    {
      "item_no": "90586563",
      "name": "STOCKHOLM 2025 side table",
      "color": "pine veneer natural"
    },
    {
      "item_no": "40528467",
      "name": "TONSTAD side table",
      "color": "brown stained oak veneer"
    },
    {
      "item_no": "00569186",
      "name": "LYCKAN chair",
      "color": "yellow/birch veneer"
    },
    {
      "item_no": "90565768",
      "name": "SKANSN\u00c3\u201eS chair",
      "color": "black beech"
    },
    {
      "item_no": "60593782",
      "name": "STOCKHOLM 2025 chair",
      "color": "dark brown/leather"
    },
    {
      "item_no": "40608242",
      "name": "BERGSHYTTAN table",
      "color": "dark brown ash veneer"
    },
    {
      "item_no": "30434657",
      "name": "KLIMPFJ\u00c3\u201eLL dining table",
      "color": "gray-brown"
    },
    {
      "item_no": "40563776",
      "name": "LISABO table",
      "color": "ash veneer"
    },
    {
      "item_no": "20593802",
      "name": "SKOGSTA dining table",
      "color": "acacia/black"
    },
    {
      "item_no": "80611884",
      "name": "SKOGSTA table",
      "color": "acacia"
    },
    {
      "item_no": "00614532",
      "name": "SKOGSTA table",
      "color": "counter height acacia/black"
    },
    {
      "item_no": "60554380",
      "name": "DOMSTEN stool",
      "color": "lilac/pine"
    },
    {
      "item_no": "80217072",
      "name": "INGATORP extendable table",
      "color": "black"
    },
    {
      "item_no": "90569097",
      "name": "VIHALS extendable table",
      "color": "white"
    }
  ],
  "profiles": [
    {
      "item_no": "10367461",
      "tier": "accent",
      "placement": "floor",
      "categories": [